{
  "metadata": {
    "title": "Português 5.º — Oralidade e Vocabulário",
    "subtitle": "Compreensão e expressão oral; enriquecimento lexical",
    "description": "Planeamento de apresentações, interação e ampliação de vocabulário, coerente com as AE de Português.",
    "unit": "PT5_ORAL",
    "version": "v1",
    "footer": "Complementa as unidades de Leitura e de Escrita & Gramática."
  },
  "cards": [
    {
      "id": 1,
      "tema": "Compreensão do oral",
      "curto": false,
      "q": "Como podes distinguir facto de opinião num texto oral?",
      "a": "Facto verifica‑se e comprova‑se; opinião expressa juízos pessoais."
    },
    {
      "id": 2,
      "tema": "Expressão oral",
      "curto": true,
      "q": "Indica duas estratégias para captar a atenção do público.",
      "a": "Olhar o público e variar o tom/ritmo da voz."
    },
    {
      "id": 3,
      "tema": "Planificação",
      "curto": false,
      "q": "Que passos segues para preparar uma apresentação breve?",
      "a": "Definir objetivo, selecionar ideias-chave, planificar introdução‑desenvolvimento‑conclusão e ensaiar."
    },
    {
      "id": 4,
      "tema": "Vocabulário",
      "curto": true,
      "q": "O que é um sinónimo? E um antónimo?",
      "a": "Palavra de sentido semelhante; palavra de sentido oposto."
    },
    {
      "id": 5,
      "tema": "Coesão",
      "curto": false,
      "q": "Dá três conectores úteis para acrescentar ideias.",
      "a": "«e», «além disso», «também»."
    },
    {
      "id": 6,
      "tema": "Registo",
      "curto": true,
      "q": "Que diferenças há entre registo formal e informal?",
      "a": "No formal usamos tratamento e vocabulário cuidado; no informal usamos linguagem mais espontânea."
    },
    {
      "id": 7,
      "tema": "Reformulação",
      "curto": false,
      "q": "Para que serve reformular/parafrasear o que ouves?",
      "a": "Para verificar compreensão e clarificar a mensagem antes de responder."
    },
    {
      "id": 8,
      "tema": "Vocabulário",
      "curto": true,
      "q": "O que é um campo lexical?",
      "a": "Conjunto de palavras relacionadas pelo tema (ex.: «escola»: caderno, aula, professor…)."
    },
    {
      "id": 9,
      "tema": "Interação",
      "curto": false,
      "q": "Que regras respeitas numa discussão?",
      "a": "Ouvir sem interromper, fundamentar opiniões, respeitar turnos de fala e o ponto de vista dos outros."
    },
    {
      "id": 10,
      "tema": "Pronúncia",
      "curto": true,
      "q": "Como podes tornar a articulação mais clara?",
      "a": "Falar devagar, projetar a voz e articular bem as palavras."
    },
    {
      "id": 11,
      "tema": "Vocabulário",
      "curto": true,
      "q": "O que é uma família de palavras?",
      "a": "Palavras derivadas do mesmo radical (ex.: mar, marinho, marear)."
    },
    {
      "id": 12,
      "tema": "Avaliação",
      "curto": false,
      "q": "Como podes autoavaliar uma apresentação oral?",
      "a": "Usar uma grelha: objetivo cumprido, estrutura, clareza, contacto visual, tempo, vocabulário e correção."
    }
  ],
  "distractors": {
    "1": [
      "Opinião é sempre verdadeira",
      "Facto é o que cada pessoa pensa",
      "Não há diferença"
    ],
    "2": [
      "Falar sempre ao mesmo tom",
      "Ler o texto de costas para a turma",
      "Evitar contacto visual"
    ],
    "3": [
      "Dispensar ensaio",
      "Inventar tudo no momento",
      "Usar só imagens sem texto"
    ],
    "4": [
      "Palavra que rima",
      "Palavra estrangeira",
      "Palavra sem significado"
    ],
    "5": [
      "«mas», «porém», «contudo»",
      "«porque», «logo que»",
      "«embora», «mesmo que»"
    ],
    "6": [
      "São exatamente iguais",
      "No formal usamos gíria",
      "No informal evitamos cumprimentos"
    ],
    "7": [
      "Para confundir o interlocutor",
      "Para alongar a conversa",
      "Para fugir ao tema"
    ],
    "8": [
      "Conjunto de letras iguais",
      "Grupo de frases com rima",
      "Palavras sem relação entre si"
    ],
    "9": [
      "Interromper para ser ouvido",
      "Elevar o tom de voz sempre",
      "Ignorar as regras da turma"
    ],
    "10": [
      "Falar muito rápido",
      "Sussurrar",
      "Evitar pausas"
    ],
    "11": [
      "Palavras do mesmo autor",
      "Palavras com igual número de sílabas",
      "Palavras com a mesma letra inicial"
    ],
    "12": [
      "Apenas pedir a nota ao professor",
      "Comparar com colegas",
      "Não refletir sobre o desempenho"
    ]
  },
  "trueFalse": [
    {
      "t": "Numa intervenção oral, a organização das ideias influencia a compreensão do público.",
      "v": true,
      "e": "Introdução, desenvolvimento e conclusão facilitam seguir o raciocínio."
    },
    {
      "t": "Sinónimos são palavras de sentido oposto.",
      "v": false,
      "e": "Os de sentido oposto são antónimos."
    },
    {
      "t": "O registo formal exige escolhas linguísticas adequadas ao contexto.",
      "v": true,
      "e": "Tratamento, vocabulário e construção frásica devem ser cuidados."
    },
    {
      "t": "Reformular ajuda a confirmar se percebeste corretamente o interlocutor.",
      "v": true,
      "e": "É uma estratégia de comunicação eficaz."
    },
    {
      "t": "Campo lexical junta palavras relacionadas por tema.",
      "v": true,
      "e": "Ex.: «escola» agrupa vocábulos próprios desse domínio."
    },
    {
      "t": "Numa discussão é aceitável interromper constantemente.",
      "v": false,
      "e": "Devem respeitar-se os turnos de fala."
    },
    {
      "t": "Respirar e fazer pausas ajuda na clareza da fala.",
      "v": true,
      "e": "Melhora a dicção e o ritmo."
    },
    {
      "t": "Uma boa apresentação dispensa preparação.",
      "v": false,
      "e": "Planificar e ensaiar melhora a qualidade."
    }
  ]
}